Sheet: Base Max Stats
A1: Class Name | B1: HP | C1: Strength | D1: Magic | E1: Dexterity | F1: Agility | G1: Luck | H1: Build | I1: Wisdom | J1: Total | K1: Weapons | L1: Skills
A2: Base | B2: 55 | C2: 25 | D2: 25 | E2: 25 | F2: 25 | G2: 25 | H2: 25 | I2: 25 | J2: of:=SUM([.B2:.I2]) -> 230 | K2: Sword
A3: Myrmidon | B3: 54 | C3: 25 | D3: 20 | E3: 29 | F3: 30 | G3: 27 | H3: 23 | I3: 22 | J3: of:=SUM([.B3:.I3]) -> 230 | K3: Sword | M3: Evasive Stance
A4: Mercenary | B4: 56 | C4: 26 | D4: 20 | E4: 27 | F4: 28 | G4: 25 | H4: 26 | I4: 22 | J4: of:=SUM([.B4:.I4]) -> 230 | K4: Sword | M4: Darting Blow
A5: Soldier | B5: 57 | C5: 27 | D5: 20 | E5: 26 | F5: 25 | G5: 24 | H5: 27 | I5: 24 | J5: of:=SUM([.B5:.I5]) -> 230 | K5: Lance
A6: Knight | B6: 58 | C6: 29 | D6: 20 | E6: 24 | F6: 21 | G6: 23 | H6: 30 | I6: 25 | J6: of:=SUM([.B6:.I6]) -> 230 | K6: Lance | M6: Armored Stance
A7: Bandit | B7: 60 | C7: 30 | D7: 20 | E7: 24 | F7: 28 | G7: 21 | H7: 26 | I7: 21 | J7: of:=SUM([.B7:.I7]) -> 230 | K7: Axe | M7: Death Blow
A8: Fighter | B8: 58 | C8: 30 | D8: 20 | E8: 24 | F8: 26 | G8: 22 | H8: 28 | I8: 22 | J8: of:=SUM([.B8:.I8]) -> 230 | K8: Axe | M8: Fierce Blow
A9: Brawler | B9: 60 | C9: 27 | D9: 20 | E9: 26 | F9: 28 | G9: 23 | H9: 24 | I9: 22 | J9: of:=SUM([.B9:.I9]) -> 230 | K9: Brawl
A10: Apprentice | B10: 55 | C10: 26 | D10: 20 | E10: 25 | F10: 27 | G10: 28 | H10: 23 | I10: 26 | J10: of:=SUM([.B10:.I10]) -> 230 | K10: Brawl
A11: Thief | B11: 52 | C11: 24 | D11: 20 | E11: 30 | F11: 30 | G11: 30 | H11: 22 | I11: 22 | J11: of:=SUM([.B11:.I11]) -> 230 | K11: Dagger
A12: Spy | B12: 53 | C12: 25 | D12: 20 | E12: 30 | F12: 30 | G12: 28 | H12: 22 | I12: 22 | J12: of:=SUM([.B12:.I12]) -> 230 | K12: Dagger
A13: Archer | B13: 54 | C13: 26 | D13: 20 | E13: 30 | F13: 26 | G13: 28 | H13: 23 | I13: 23 | J13: of:=SUM([.B13:.I13]) -> 230 | K13: Bow | M13: Certain Blow
A14: Nomad | B14: 53 | C14: 25 | D14: 20 | E14: 29 | F14: 28 | G14: 29 | H14: 22 | I14: 24 | J14: of:=SUM([.B14:.I14]) -> 230 | K14: Bow
A15: Dancer | B15: 52 | C15: 23 | D15: 20 | E15: 26 | F15: 30 | G15: 30 | H15: 22 | I15: 27 | J15: of:=SUM([.B15:.I15]) -> 230 | K15: Staff | M15: Blade Dance
A16: Priest | B16: 52 | C16: 20 | D16: 25 | E16: 25 | F16: 27 | G16: 30 | H16: 21 | I16: 30 | J16: of:=SUM([.B16:.I16]) -> 230 | K16: Faith
A17: Monk | B17: 53 | C17: 20 | D17: 26 | E17: 27 | F17: 24 | G17: 29 | H17: 22 | I17: 29 | J17: of:=SUM([.B17:.I17]) -> 230 | K17: Faith
A18: Scientist | B18: 55 | C18: 20 | D18: 27 | E18: 30 | F18: 24 | G18: 23 | H18: 24 | I18: 27 | J18: of:=SUM([.B18:.I18]) -> 230 | K18: Reason
A19: Hacker | B19: 53 | C19: 20 | D19: 25 | E19: 30 | F19: 28 | G19: 26 | H19: 22 | I19: 26 | J19: of:=SUM([.B19:.I19]) -> 230 | K19: Reason
A20: Hexer | B20: 57 | C20: 20 | D20: 29 | E20: 26 | F20: 25 | G20: 22 | H20: 22 | I20: 29 | J20: of:=SUM([.B20:.I20]) -> 230 | K20: Arcane
A21: Cantor | B21: 59 | C21: 20 | D21: 30 | E21: 23 | F21: 29 | G21: 21 | H21: 21 | I21: 27 | J21: of:=SUM([.B21:.I21]) -> 230 | K21: Arcane
A22: Diviner | B22: 53 | C22: 20 | D22: 25 | E22: 27 | F22: 30 | G22: 28 | H22: 21 | I22: 26 | J22: of:=SUM([.B22:.I22]) -> 230 | K22: Storm
A23: Wizard | B23: 54 | C23: 20 | D23: 26 | E23: 29 | F23: 27 | G23: 25 | H23: 23 | I23: 26 | J23: of:=SUM([.B23:.I23]) -> 230 | K23: Storm
A24: Shaman | B24: 55 | C24: 20 | D24: 26 | E24: 25 | F24: 23 | G24: 28 | H24: 24 | I24: 29 | J24: of:=SUM([.B24:.I24]) -> 230 | K24: Nature | M24: Blessed Stance
A25: Keeper | B25: 57 | C25: 20 | D25: 27 | E25: 24 | F25: 21 | G25: 27 | H25: 26 | I25: 28 | J25: of:=SUM([.B25:.I25]) -> 230 | K25: Nature | M25: Warding Stance
A26: Mage | B26: 54 | C26: 20 | D26: 30 | E26: 28 | F26: 26 | G26: 25 | H26: 21 | I26: 26 | J26: of:=SUM([.B26:.I26]) -> 230 | K26: Cosmic
A27: Scholar | B27: 53 | C27: 20 | D27: 28 | E27: 29 | F27: 25 | G27: 27 | H27: 21 | I27: 27 | J27: of:=SUM([.B27:.I27]) -> 230 | K27: Cosmic
A28: Bard | B28: 51 | C28: 20 | D28: 23 | E28: 25 | F28: 30 | G28: 30 | H28: 21 | I28: 30 | J28: of:=SUM([.B28:.I28]) -> 230 | K28: Staff | M28: Fan Dance

Sheet: Promoted Max Stats
A1: Class Name | B1: HP | C1: Strength | D1: Magic | E1: Dexterity | F1: Agility | G1: Luck | H1: Build | I1: Wisdom | J1: Total | K1: Weapons
A2: Base | B2: 70 | C2: 30 | D2: 30 | E2: 30 | F2: 30 | G2: 30 | H2: 30 | I2: 30 | J2: of:=SUM([.B2:.I2]) -> 280 | K2: Sword
A3: weapon | B3: 71 | C3: 33 | D3: 25 | E3: 30 | F3: 30 | G3: 30 | H3: 33 | I3: 28 | J3: of:=SUM([.B3:.I3]) -> 280
A4: magic | B4: 69 | C4: 25 | D4: 34 | E4: 30 | F4: 30 | G4: 30 | H4: 28 | I4: 34 | J4: of:=SUM([.B4:.I4]) -> 280
A5: Duelist | B5: 69 | C5: 30 | D5: 25 | E5: 34 | F5: 35 | G5: 32 | H5: 28 | I5: 27 | J5: of:=SUM([.B5:.I5]) -> 280 | K5: Sword
A6: Paladin | B6: 71 | C6: 31 | D6: 25 | E6: 31 | F6: 30 | G6: 30 | H6: 32 | I6: 30 | J6: of:=SUM([.B6:.I6]) -> 280 | K6: Sword | L6: Lance
A7: Hero | B7: 71 | C7: 31 | D7: 25 | E7: 32 | F7: 33 | G7: 30 | H7: 31 | I7: 27 | J7: of:=SUM([.B7:.I7]) -> 280 | K7: Sword | L7: Axe
A8: Dread Fighter | D8: 25 | J8: of:=SUM([.B8:.I8]) -> 25 | K8: Sword | L8: Brawl
A9: Fencer | B9: 68 | C9: 30 | D9: 25 | E9: 33 | F9: 36 | G9: 33 | H9: 27 | I9: 28 | J9: of:=SUM([.B9:.I9]) -> 280 | K9: Sword | L9: Dagger
A10: Ranger | D10: 25 | J10: of:=SUM([.B10:.I10]) -> 25 | K10: Sword | L10: Bow
A11: Savant | J11: of:=SUM([.B11:.I11]) -> 0 | K11: Sword | L11: Staff
A12: Gladiator | B12: 72 | C12: 32 | D12: 25 | E12: 31 | F12: 30 | G12: 29 | H12: 32 | I12: 29 | J12: of:=SUM([.B12:.I12]) -> 280 | K12: Lance
A13: General | D13: 25 | F13: 25 | H13: 36 | J13: of:=SUM([.B13:.I13]) -> 86 | K13: Lance | L13: Axe
A14: Sentinel | D14: 25 | J14: of:=SUM([.B14:.I14]) -> 25 | K14: Lance | L14: Brawl
A15: Merchant | B15: 70 | C15: 30 | D15: 25 | E15: 32 | F15: 31 | G15: 33 | H15: 29 | I15: 30 | J15: of:=SUM([.B15:.I15]) -> 280 | K15: Lance | L15: Dagger
A16: Hunter | D16: 25 | J16: of:=SUM([.B16:.I16]) -> 25 | K16: Lance | L16: Bow
A17: Harrier | B17: 67 | C17: 29 | D17: 26 | E17: 32 | F17: 33 | G17: 32 | H17: 29 | I17: 32 | J17: of:=SUM([.B17:.I17]) -> 280 | K17: Lance | L17: Staff
A18: Berserker | B18: 75 | C18: 36 | D18: 25 | E18: 29 | F18: 33 | G18: 26 | H18: 30 | I18: 26 | J18: of:=SUM([.B18:.I18]) -> 280 | K18: Axe
A19: Blacksmith | C19: 34 | D19: 25 | H19: 34 | J19: of:=SUM([.B19:.I19]) -> 93 | K19: Axe | L19: Brawl
A20: Reaver | D20: 25 | J20: of:=SUM([.B20:.I20]) -> 25 | K20: Axe | L20: Dagger
A21: Warrior | B21: 73 | C21: 35 | D21: 25 | E21: 31 | F21: 29 | G21: 27 | H21: 33 | I21: 27 | J21: of:=SUM([.B21:.I21]) -> 280 | K21: Axe | L21: Bow
A22: Daemon | B22: 72 | C22: 32 | D22: 30 | E22: 26 | F22: 31 | G22: 26 | H22: 32 | I22: 31 | J22: of:=SUM([.B22:.I22]) -> 280 | K22: Axe | L22: Staff
A23: Grappler | B23: 76 | C23: 32 | D23: 25 | E23: 31 | F23: 33 | G23: 28 | H23: 28 | I23: 27 | J23: of:=SUM([.B23:.I23]) -> 280 | K23: Brawl
A24: Adventurer | D24: 25 | J24: of:=SUM([.B24:.I24]) -> 25 | K24: Brawl | L24: Dagger
A25: Machinist | D25: 25 | J25: of:=SUM([.B25:.I25]) -> 25 | K25: Brawl | L25: Bow
A26: Retainer | B26: 72 | C26: 29 | D26: 27 | E26: 30 | F26: 32 | G26: 32 | H26: 28 | I26: 30 | J26: of:=SUM([.B26:.I26]) -> 280 | K26: Brawl | L26: Staff
A27: Assassin | B27: 68 | C27: 30 | D27: 25 | E27: 35 | F27: 35 | G27: 33 | H27: 27 | I27: 27 | J27: of:=SUM([.B27:.I27]) -> 280 | K27: Dagger
A28: Rogue | B28: 67 | C28: 29 | D28: 25 | E28: 35 | F28: 35 | G28: 35 | H28: 27 | I28: 27 | J28: of:=SUM([.B28:.I28]) -> 280 | K28: Dagger | L28: Bow
A29: Trickster | B29: 67 | C29: 28 | D29: 27 | E29: 33 | F29: 35 | G29: 33 | H29: 26 | I29: 31 | J29: of:=SUM([.B29:.I29]) -> 280 | K29: Dagger | L29: Staff
A30: Sniper | B30: 69 | C30: 30 | D30: 25 | E30: 36 | F30: 31 | G30: 33 | H30: 28 | I30: 28 | J30: of:=SUM([.B30:.I30]) -> 280 | K30: Bow
A31: High Priest | D31: 25 | J31: of:=SUM([.B31:.I31]) -> 25 | K31: Bow | L31: Staff
A32: Dancer | D32: 25 | J32: of:=SUM([.B32:.I32]) -> 25 | K32: Staff
A33: Bishop | C33: 25 | J33: of:=SUM([.B33:.I33]) -> 25 | K33: Faith
A34: Medic | C34: 25 | I34: 36 | J34: of:=SUM([.B34:.I34]) -> 61 | K34: Faith | L34: Reason
A35: Summoner | C35: 25 | J35: of:=SUM([.B35:.I35]) -> 25 | K35: Faith | L35: Arcane
A36: Oracle | C36: 25 | J36: of:=SUM([.B36:.I36]) -> 25 | K36: Faith | L36: Storm
A37: Druid | C37: 25 | I37: 35 | J37: of:=SUM([.B37:.I37]) -> 60 | K37: Faith | L37: Nature
A38: Chronomancer | C38: 25 | J38: of:=SUM([.B38:.I38]) -> 25 | K38: Faith | L38: Cosmic
A39: War Monk | J39: of:=SUM([.B39:.I39]) -> 0 | K39: Faith | L39: Staff
A40: Engineer | C40: 25 | J40: of:=SUM([.B40:.I40]) -> 25 | K40: Reason
A41: Cipher | C41: 25 | J41: of:=SUM([.B41:.I41]) -> 25 | K41: Reason | L41: Arcane
A42: Chemist | C42: 25 | J42: of:=SUM([.B42:.I42]) -> 25 | K42: Reason | L42: Storm
A43: Metallurgist | C43: 25 | J43: of:=SUM([.B43:.I43]) -> 25 | K43: Reason | L43: Nature
A44: Reactor | C44: 25 | D44: 36 | J44: of:=SUM([.B44:.I44]) -> 61 | K44: Reason | L44: Cosmic
A45: Artificer | J45: of:=SUM([.B45:.I45]) -> 0 | K45: Reason | L45: Staff
A46: Warlock | C46: 25 | D46: 35 | J46: of:=SUM([.B46:.I46]) -> 60 | K46: Arcane
C47: 25 | J47: of:=SUM([.B47:.I47]) -> 25 | K47: Arcane | L47: Storm
A48: Gravedigger | C48: 25 | J48: of:=SUM([.B48:.I48]) -> 25 | K48: Arcane | L48: Nature
C49: 25 | J49: of:=SUM([.B49:.I49]) -> 25 | K49: Arcane | L49: Cosmic
A50: Enchanter | J50: of:=SUM([.B50:.I50]) -> 0 | K50: Arcane | L50: Staff
A51: Stormcaller | C51: 25 | J51: of:=SUM([.B51:.I51]) -> 25 | K51: Storm
A52: Pirate | C52: 25 | J52: of:=SUM([.B52:.I52]) -> 25 | K52: Storm | L52: Nature
A53: Astrologian | C53: 25 | J53: of:=SUM([.B53:.I53]) -> 25 | K53: Storm | L53: Cosmic
A54: Spellblade | J54: of:=SUM([.B54:.I54]) -> 0 | K54: Storm | L54: Staff
A55: Geomancer | C55: 25 | J55: of:=SUM([.B55:.I55]) -> 25 | K55: Nature
A56: Stargazer | C56: 25 | J56: of:=SUM([.B56:.I56]) -> 25 | K56: Nature | L56: Cosmic
A57: Warden | J57: of:=SUM([.B57:.I57]) -> 0 | K57: Nature | L57: Staff
A58: Astronomer | C58: 25 | J58: of:=SUM([.B58:.I58]) -> 25 | K58: Cosmic
A59: Blazer | J59: of:=SUM([.B59:.I59]) -> 0 | K59: Cosmic | L59: Staff
A60: Bard | C60: 25 | G60: 36 | J60: of:=SUM([.B60:.I60]) -> 61 | K60: Staff

Sheet: Monster Max Stats
A1: Line | B1: HP | C1: Strength | D1: Magic | E1: Dexterity | F1: Agility | G1: Luck | H1: Build | I1: Wisdom | J1: Total | K1: Weapons
A2: Base | B2: 70 | C2: 30 | D2: 30 | E2: 30 | F2: 30 | G2: 30 | H2: 30 | I2: 30 | J2: of:=SUM([.B2:.I2]) -> 280 | K2: Sword
A3: weapon | B3: 71 | C3: 33 | D3: 25 | E3: 30 | F3: 30 | G3: 30 | H3: 33 | I3: 28 | J3: of:=SUM([.B3:.I3]) -> 280
A4: magic | B4: 69 | C4: 25 | D4: 34 | E4: 30 | F4: 30 | G4: 30 | H4: 28 | I4: 34 | J4: of:=SUM([.B4:.I4]) -> 280
A5: Bonewalker | K5: Melee | L5: Infantry
A6: Guardian | K6: Melee | L6: Armored
A7: Gargoyle | K7: Melee | L7: Flying
A8: Tarvos | K8: Melee | L8: Cavalry
A9: Scamp | K9: Ranged | L9: Thief
A10: Cyclops | K10: Two-Handed | L10: Large
A11: Revenant | K11: Claws
A12: Faceless | K12: Brawl
A13: Bael | K13: Claws
A14: Hellhound | K14: Jaws
A15: Angel | K15: Faith | L15: Arcane
A16: Phantasm | K16: Reason | L16: Arcane
A17: Mogall | K17: Arcane
A18: Harpy | K18: Arcane | L18: Storm
A19: Stoneborn | K19: Arcane | L19: Nature
A20: Gorgon | K20: Arcane
A21: Chimera | K21: Arcane
A22: Necrodragon | K22: Magic
A23: Giant Bird | K23: Beak | L23: Talon
A24: Giant Wolf | K24: Fang
A25: Giant Lynx | K25: Fang | L25: Jaws
A26: Giant Crawler | K26: Magic